ObjectID,GlobalID,What are you reporting?,Date of Incident,Time period of incident,Reporting behavior of a....,Who was impacted?,Were children present?,Is this a recurring incident?,Please describe the incident in your own words,Jurisdiction,Other,Pedestrian / Biking Path,Area,Travel Lane,Were weather conditions a likely factor?,Weather conditions,Pedestrian behavior factors,Driver / Cyclist behavior factors,Unsafe conditions / environmental factors,Additional comments,Would you be willing to share your contact information with local authorities?,Full name,Email address,Phone Number,Mailing Address,Select one or more NoVA FSS Charters to subscribe to communications:,Do you want to use the same contact information as above?,Full name.1,Email address.1,Phone number,Mailing address,How did you hear about us?,Please let us know where you heard about us?,CreationDate,Creator,EditDate,Editor,x,y,y_rad,x_rad,cluster
100,aef72e88-3d19-408f-89ee-3a296fe88dbe,Near_Miss,11/1/22 0:00,6,Driver,Person_Walking,No,No,Left turning vehicle neatly struck pedestrian crossing the Reston Parkway from west to east on the south leg. Ped signal was green. Driver looked in shock.,Fairfax County,,Crosswalk,Traffic_Light,Left_Turn_Lane,No,,,"Distracted,Failure_to_Yield",,,No,,,,,,No,,,,,,,12/7/22 13:48,Alexandria_FSS,12/7/22 13:48,Alexandria_FSS,-77.36689615,38.93510309,0.679545743523918,-1.350307069866025,26
286,3c15c829-44b7-417e-bbd2-6cac5f8d9005,Dangerous_Location,6/12/21 0:00,8,Unsafe Condition,"Person_Driving,Person_Walking",No,Yes,The RA pathway runs through the Pinecrest Cluster here. People park on both sides of the street and frequently block the trail and visibility is very poor. Driving and walking here is dangerous. Street parking over road safety? No,Fairfax County,,Trail,,,No,,,,"Obstruction_in_Path,Poor_Visibility",,No,,,,,,No,,,,,Other,Friend,12/7/22 13:48,Alexandria_FSS,12/7/22 13:48,Alexandria_FSS,-77.36890827,38.9372712,0.6795835841819635,-1.35034218798497,26
1548,bc927e6a-da39-4c98-bf95-a8af9e865456,Near_Miss,5/1/21 0:00,4,Driver,Person_Walking,No,No,,Fairfax County,,Crosswalk,,,No,,,Speeding,Not_Enough_Time_To_Cross,,No,,,,,,No,,,,,,,12/7/22 13:48,Alexandria_FSS,12/7/22 13:48,Alexandria_FSS,-77.36706029,38.94094361,0.6796476798279466,-1.350309934649459,26
1727,ec5dfcd2-f05d-45e5-a8fb-34ecf9b77805,Near_Miss,5/15/21 0:00,5,Driver,Person_Walking,No,No,The time was ~2:30pm (I cannot seem to adjust the time on my iphone).,Fairfax County,,"Crosswalk,Trail",Stop_Sign,,No,,,Speeding,"Obstruction_in_Path,Other,Poor_Visibility",,No,,,,,,No,,,,,Word of Mouth,,12/7/22 13:48,Alexandria_FSS,12/7/22 13:48,Alexandria_FSS,-77.36727417,38.94081963,0.67964551596874,-1.3503136675596632,26
1962,dd043fb4-89c2-46eb-8e44-29f5a0659f0f,Near_Miss,3/8/23 17:00,3,Driver,Cyclist,No,Yes,"Crossing Reston Parkway from NE corner to NW corner on Glade Dr. in crosswalk.  Have walk signal.  I'm on my bike going walking speed.  Driver is southbound on Reston Parkway, in turn lane to go West on Glade Dr. (turning right).  Driver speeds to red light and goes through it.  I yell, she sees me in crosswalk and slams on her brakes, stopping over crosswalk 2 feet from me. I saw her and stopped short of the turning lane. So when stopped her driver's door is right in front of me.  No one was hurt.",Fairfax County,,Crosswalk,Traffic_Light,Right_Turn_Lane,No,,,"Failure_to_Yield,Improper_Right_Turn,Speeding",,Too many drivers don't even slow on red light.,No,,,,,Fairfax_County,,Tom Wyland,tomwyland@gmail.com,,,Other,Fairfax Alliance for Better Bicycling,3/8/23 18:29,,3/8/23 18:29,,-77.36688546,38.93529086,0.6795490207286546,-1.3503068832903278,26
