ObjectID,GlobalID,What are you reporting?,Date of Incident,Time period of incident,Reporting behavior of a....,Who was impacted?,Were children present?,Is this a recurring incident?,Please describe the incident in your own words,Jurisdiction,Other,Pedestrian / Biking Path,Area,Travel Lane,Were weather conditions a likely factor?,Weather conditions,Pedestrian behavior factors,Driver / Cyclist behavior factors,Unsafe conditions / environmental factors,Additional comments,Would you be willing to share your contact information with local authorities?,Full name,Email address,Phone Number,Mailing Address,Select one or more NoVA FSS Charters to subscribe to communications:,Do you want to use the same contact information as above?,Full name.1,Email address.1,Phone number,Mailing address,How did you hear about us?,Please let us know where you heard about us?,CreationDate,Creator,EditDate,Editor,x,y,y_rad,x_rad,cluster
142,b60d0973-c688-401f-9447-927668ce6d13,Near_Miss,11/10/21 0:00,7,Driver,Person_Walking,No,No,Evening,Fairfax County,,Crosswalk,Traffic_Light,Left_Turn_Lane,No,,,Failure_to_Yield,Poor_Visibility,,No,,,,,,No,,,,,,,12/7/22 13:48,Alexandria_FSS,12/7/22 13:48,Alexandria_FSS,-77.1407499,38.84554005,0.6779825735878227,-1.3463600732124865,35
150,79514336-0de4-4f7e-9fd5-e70a9320d8c4,Near_Miss,10/14/22 0:00,7,Driver,Person_Walking,No,No,"Drivers speed through this stop sign with no regard to pedestrians. Sometimes even when seen, just swerve around them.",Fairfax County,,Crosswalk,Stop_Sign,,No,,,"Running_Light_Sign,Speeding",,,No,,,,,,No,,,,,Other,Email,12/7/22 13:48,Alexandria_FSS,12/7/22 13:48,Alexandria_FSS,-77.14752039,38.85211684,0.678097360227535,-1.3464782405549598,35
593,0821de1a-0b47-4977-892d-d300ddee5c22,Near_Miss,10/28/22 0:00,6,Cyclist,Person_Driving,No,No,"Cyclist ringing a loud bell speed though intersection, failing to stop or yield to other cars crossing though intersection. Cars had to slam on brakes to avoid very obnoxious and brazen attitude of as he weaved around cars, almost hitting me",Fairfax County,,,Stop_Sign,,No,,,"Failure_to_Yield,Running_Light_Sign",,,No,,,,,,No,,,,,Other,Community,12/7/22 13:48,Alexandria_FSS,12/7/22 13:48,Alexandria_FSS,-77.14365354,38.84939449,0.6780498462566433,-1.3464107512907793,35
743,3d3acd1d-f1dc-480f-8a02-04244c42ac57,"Dangerous_Location,Near_Miss",11/1/22 0:00,6,Driver,Person_Driving,No,Yes,This stop sign is primarily ignored by drivers. This is a very dangerous intersection.,Fairfax County,,Crosswalk,Stop_Sign,,No,,,Running_Light_Sign,,,No,,,,,,No,,,,,Word of Mouth,Community,12/7/22 13:48,Alexandria_FSS,12/7/22 13:48,Alexandria_FSS,-77.14756284,38.85205049,0.6780962022015763,-1.3464789814472276,35
1217,7df413ce-7d0e-43c6-9b4b-3599fd013814,Near_Miss,10/28/22 0:00,3,Driver,Person_Walking,No,Yes,"Intersection traffic causes non stop honking with cars not following laws (full stop, speeding) or common courtesy. I live off the intersection and probably hear or view 2-5 near misses on a daily basis.",Fairfax County,,,Stop_Sign,"Left_Turn_Lane,Right_Turn_Lane",No,,,"Running_Light_Sign,Speeding",,,Yes,Eric Kukula,ekukula@gmail.com,1-765-479-4025,3442 Blair Road,Fairfax_County,Yes,,,,,Other,Community listserv,12/7/22 13:48,Alexandria_FSS,12/7/22 13:48,Alexandria_FSS,-77.14362163,38.84938215,0.6780496308830135,-1.3464101943562148,35
1499,bbcfaddc-bb2b-4eb0-aeac-2fdc7c9b888a,Near_Miss,10/28/22 0:00,4,Driver,Person_Walking,No,Yes,The stop signs on Blair Road at Pinetree Terrace are routinely and repeatedly run through by drivers on Blair Road.  About one in ten drivers actually stops at the stop signs.,Fairfax County,,,Stop_Sign,,No,,,Running_Light_Sign,,,Yes,K. ekman,Forleasealexandria@gmail.com,,,Fairfax_County,Yes,,,,,Word of Mouth,Lake barcroft neighbors email,12/7/22 13:48,Alexandria_FSS,12/7/22 13:48,Alexandria_FSS,-77.1423,38.84901001,0.6780431358147352,-1.3463871275612218,35
1624,a79c0987-37c7-443f-a566-9ad5a1edf711,Near_Miss,11/6/21 0:00,4,Cyclist,Person_Driving,No,No,"An ongoing problem with cyclists who refuse to stop, or even slow down to yield to adults and children coming and going to school. They become very confrontational if this is brough to their attention. They are breaking the law and should be ticketed.",Fairfax County,,Crosswalk,Stop_Sign,,No,,,"Failure_to_Yield,Running_Light_Sign",,,Yes,Joseph Franco,jjafranco@gmail.com,,,,No,,,,,Word of Mouth,,12/7/22 13:48,Alexandria_FSS,12/7/22 13:48,Alexandria_FSS,-77.147771,38.85185799,0.6780928424427661,-1.3464826145245985,35
1719,cdee5ab0-f0e4-4e3e-aaea-6d68b81ac7e1,"Dangerous_Location,Near_Miss",1/12/22 0:00,5,Driver,Person_Driving,No,Yes,"This is a two-way stop, but everyone assumes it's four-way. I'm nearly t-boned here almost daily as people barely stop or roll through the stop sign--they assume cross-traffic also has to stop (they don't). It would be much safer as a four-way stop.",Fairfax County,,,Stop_Sign,,No,,,Running_Light_Sign,,,Yes,Shea Connelly,shea.c.connelly@gmail.com,,,,No,,,,,,,12/7/22 13:48,Alexandria_FSS,12/7/22 13:48,Alexandria_FSS,-77.1463299,38.85527005,0.6781523941240418,-1.3464574625847479,35
