ObjectID,GlobalID,What are you reporting?,Date of Incident,Time period of incident,Reporting behavior of a....,Who was impacted?,Were children present?,Is this a recurring incident?,Please describe the incident in your own words,Jurisdiction,Other,Pedestrian / Biking Path,Area,Travel Lane,Were weather conditions a likely factor?,Weather conditions,Pedestrian behavior factors,Driver / Cyclist behavior factors,Unsafe conditions / environmental factors,Additional comments,Would you be willing to share your contact information with local authorities?,Full name,Email address,Phone Number,Mailing Address,Select one or more NoVA FSS Charters to subscribe to communications:,Do you want to use the same contact information as above?,Full name.1,Email address.1,Phone number,Mailing address,How did you hear about us?,Please let us know where you heard about us?,CreationDate,Creator,EditDate,Editor,x,y,y_rad,x_rad,cluster
103,af610355-8456-42ac-97aa-e046a3ce06fc,Near_Miss,8/21/22 0:00,7,Driver,Person_Walking,No,No,"Cars Frequently running stop sign, dangerous intersection. Person was run into and killed.",Arlington County,,Crosswalk,Stop_Sign,,No,,,Running_Light_Sign,,,No,,,,,,No,,,,,,,12/7/22 13:48,Alexandria_FSS,12/7/22 13:48,Alexandria_FSS,-77.09684308,38.86870849,0.6783869391483736,-1.3455937546394061,27
144,186b1572-8823-494e-b863-e37f7b3ad86e,Near_Miss,6/17/21 0:00,7,Driver,Person_Walking,No,No,,Arlington County,,Crosswalk,,,No,,,Failure_to_Yield,,,No,,,,,,No,,,,,,,12/7/22 13:48,Alexandria_FSS,12/7/22 13:48,Alexandria_FSS,-77.09652778,38.86755959,0.6783668870605973,-1.3455882516162745,27
1089,43d9b710-c149-4660-816a-c892ddc7e6e6,Near_Miss,11/2/22 0:00,3,Driver,Person_Walking,No,No,Speeding and failing to yield in a school zone when children are present.,Arlington County,,Crosswalk,,,No,,,"Failure_to_Yield,Speeding",,,Yes,Brent,brent.skorup@my.wheaton.edu,,,,No,,,,,,,12/7/22 13:48,Alexandria_FSS,12/7/22 13:48,Alexandria_FSS,-77.09454363,38.8692801,0.6783969156249108,-1.3455536216659212,27
1117,394a2aa8-3a14-4f96-b05c-b1192748493a,Near_Miss,10/10/22 0:00,3,Driver,Person_Walking,No,No,"Cars frequently speed at this stretch of road, despite two schools and a large park bordering the street.",Arlington County,,Crosswalk,,,No,,,"Failure_to_Yield,Speeding",,,Yes,Brent Skorup,brent.skorup@my.wheaton.edu,,,,No,,,,,,,12/7/22 13:48,Alexandria_FSS,12/7/22 13:48,Alexandria_FSS,-77.09455168,38.86929707,0.6783972118072849,-1.3455537621649258,27
1632,9fe1dc81-6f32-4027-bb5b-e537ca05a901,Near_Miss,10/21/21 0:00,4,Unsafe Condition,Person_Walking,No,No,"No crosswalk, poor visibility",Arlington County,,,,,No,,,Speeding,"No_Crosswalk,Poor_Visibility",,No,,,,,,No,,,,,Other,Social Media,12/7/22 13:48,Alexandria_FSS,12/7/22 13:48,Alexandria_FSS,-77.09104067,38.86610971,0.6783415818808386,-1.3454924834803554,27
1862,3b33be13-d781-4649-8299-3ab9cefc032e,Dangerous_Location,12/17/22 17:00,"1,2,3,4,5,6,7,8",Unsafe Condition,"Cyclist,Person_Walking,Person_Riding_Scooter,Person_with_Disability",Yes,Yes,"The crosswalk ends with the curve so if you’re riding a bicycle, you have to stop in the middle of the road to make sure that you actually get off and lift your bike before you get off the crosswalk. The same is true for scooters and persons on the wheelchair Also for strollers ",Arlington County,,"Crosswalk,Sidewalk","Parking_Street,School_Zone",,No,,,"Passing_Closely,Distracted,Failure_to_Yield,Jumping_the_Curb,Speeding","Not_Enough_Time_To_Cross,Obstruction_in_Path",,No,,,,,Arlington_County,,Shohina Touraeva,Shohinaturaeva@yahoo.com,,,Outreach Event,Farmers Market ,12/17/22 13:55,,12/17/22 13:55,,-77.08748783,38.86429436,0.6783098980462624,-1.345430474724559,27
1928,a3643c0b-e3e0-46fc-8bc5-35c9282e1045,Near_Miss,2/11/23 17:00,6,Driver,Cyclist,No,No,"I was riding south on S. Irving St., coming to a stop at the stop sign at 2nd St. S. A driver made a left from 2nd St. S. northbound on S. Irving St. He turned into the wrong side of S. Irving St. (his left) almost hitting me before he swerved right to miss me.",Arlington County,,,Stop_Sign,Through_Lane,No,,,Passing_Closely,,,No,,,,,Arlington_County,,Larry Huffman,lghuffman@gmail.com,,,Outreach Event,Bike Falls Church,2/13/23 0:57,,2/13/23 0:57,,-77.09271414,38.86987422,0.6784072849750628,-1.3455216910417886,27
1991,a52a208f-8c9c-47df-8db9-8958534e0863,Near_Miss,4/10/23 16:00,6,Driver,Person_Walking,No,No,"Driver of dark colored SUV vehicle with VA plates WNH2406, not yielding to pedestrians.",Arlington County,,Crosswalk,Traffic_Light,Right_Turn_Lane,No,,Mid_Block,"Distracted,Failure_to_Yield,Other",,Driver aggressive and turned around to blow his horn.,No,,,,,Arlington_County,,Cliff Calibuso,cliff.calibuso@live.com,,,Website,,4/10/23 19:35,,4/10/23 19:35,,-77.10017,38.86995411,0.6784086793186022,-1.3456518203473566,27
2040,ac91d261-98a6-42aa-8f88-21d77397c669,Near_Miss,6/7/23 16:00,5,Driver,Person_Walking,Yes,Yes,"Three middle school girls were walking home, just in front of me, after school ended. They were in the crosswalk and a woman driving a car eastbound was driving quickly and recklessly. She saw them midway through the street at the last moment and slammed on the brakes, narrowly missing the girls. The driver was clearly rattled at how close she was to striking them. Close calls involving children happen frequently at this crosswalk despite signage.",Arlington County,,Crosswalk,"Mid_Block,School_Zone",Through_Lane,No,,,"Distracted,Failure_to_Yield,Speeding",,,No,,,,,Arlington_County,,Brent Skorup,brent.skorup@my.wheaton.edu,,,Outreach Event,Arlington County Fair,6/14/23 13:34,,6/14/23 13:34,,-77.09455075,38.86925898,0.6783965470113728,-1.3455537459333637,27
