ObjectID,GlobalID,What are you reporting?,Date of Incident,Time period of incident,Reporting behavior of a....,Who was impacted?,Were children present?,Is this a recurring incident?,Please describe the incident in your own words,Jurisdiction,Other,Pedestrian / Biking Path,Area,Travel Lane,Were weather conditions a likely factor?,Weather conditions,Pedestrian behavior factors,Driver / Cyclist behavior factors,Unsafe conditions / environmental factors,Additional comments,Would you be willing to share your contact information with local authorities?,Full name,Email address,Phone Number,Mailing Address,Select one or more NoVA FSS Charters to subscribe to communications:,Do you want to use the same contact information as above?,Full name.1,Email address.1,Phone number,Mailing address,How did you hear about us?,Please let us know where you heard about us?,CreationDate,Creator,EditDate,Editor,x,y,y_rad,x_rad,cluster
87,a53e1ca1-ae40-45a3-9963-cc0e078dcc66,Near_Miss,4/20/22 0:00,6,Driver,Person_Walking,No,No,Driver ran red from Whiting to Edsall as I was waiting on corner; No turn on red when pedestrians are present sign,City of Alexandria,,Crosswalk,Traffic_Light,Right_Turn_Lane,No,,,"Failure_to_Yield,Running_Light_Sign",,,Yes,Stephen G. Dunham,sgdunham@verizon.net,1-571-212-0565,"782 N Howard St, Apt 104, Alexandria, VA 22304",,No,,,,,,,12/7/22 13:48,Alexandria_FSS,12/7/22 13:48,Alexandria_FSS,-77.13492334,38.80764998,0.6773212671125116,-1.3462583805564214,25
421,3401789f-8882-4c10-bf87-ed7dfeff8707,Near_Miss,12/24/18 0:00,,Driver,Person_Walking,No,No,"Woman in silver Mercedes SUV holding cell phone to ear got within 1.5 feet of me.; distracted,driver,(hand-held,cell,phone,use,while,driving)",City of Alexandria,,Crosswalk,,,No,,,"Distracted,Failure_to_Yield",,"distracted,driver,(hand-held,cell,phone,use,while,driving)",No,,,,,,No,,,,,,,12/7/22 13:48,Alexandria_FSS,12/7/22 13:48,Alexandria_FSS,-77.12899989,38.80721002,0.6773135883619344,-1.3461549968508444,25
533,499b0fbc-089f-4ea8-98a5-5e4ee89bd9cd,Near_Miss,11/12/21 0:00,5,Driver,Person_Walking,No,No,"Driver southbound on N. Van Dorn St. came to a stop completely blocking the crosswalk at Edsall Rd., and people crossing the street had to walk around.; Riding a bus stopped at the intersection",City of Alexandria,,Crosswalk,Traffic_Light,,No,,,Failure_to_Yield,"Obstruction_in_Path,Other",Parking Hazard,Yes,Stephen Gerard Dunham,sgdunham@verizon.net,1-571-212-0565,"782 N. Howard St., Apt. 104, Alexandria, VA 22304",,No,,,,,Website,Alexandria Families for Safe Streets website,12/7/22 13:48,Alexandria_FSS,12/7/22 13:48,Alexandria_FSS,-77.13338202,38.80770642,0.6773222521763415,-1.3462314794475947,25
721,f503b7e2-231b-4bbb-9429-16adfeacdd89,Near_Miss,4/20/22 0:00,6,Driver,Person_Walking,No,No,Driver ran red light as I was crossing Edsall Rd,City of Alexandria,,Crosswalk,Traffic_Light,,No,,,"Failure_to_Yield,Running_Light_Sign",,,Yes,Stephen G. Dunham,sgdunham@verizon.net,1-571-212-0565,"782 N Howard St, Apt 104, Alexandria, VA 22304",,No,,,,,,,12/7/22 13:48,Alexandria_FSS,12/7/22 13:48,Alexandria_FSS,-77.13472964,38.80754097,0.6773193645290939,-1.3462549998536604,25
750,ed997f92-8e6e-4349-b0e6-36d239f370b1,Near_Miss,5/20/22 0:00,6,Driver,Person_Walking,No,No,Driver going east on Stevenson turning right onto S Van Dorn wouldn't yield to people trying to cross S Van Dorn with a Walk sign,City of Alexandria,,Crosswalk,Traffic_Light,Right_Turn_Lane,No,,,Failure_to_Yield,,,Yes,Stephen G. Dunham,sgdunham@verizon.net,1-571-212-0565,"782 N Howard St, Apt 104, Alexandria, VA 22304",,No,,,,,,,12/7/22 13:48,Alexandria_FSS,12/7/22 13:48,Alexandria_FSS,-77.13205969,38.81117855,0.6773828522768987,-1.3462084004352968,25
889,90df0ba1-c535-4641-8c12-6e401f4bef49,Near_Miss,8/16/22 0:00,6,Driver,Person_Walking,No,No,Driver turned without signaling into the crosswalk while people were in it crossing with a Walk sign,City of Alexandria,,Crosswalk,Traffic_Light,Right_Turn_Lane,No,,,"Failure_to_Yield,Improper_Right_Turn",,,Yes,Stephen G. Dunham,sgdunham@verizon.net,1-571-212-0565,"8-5 Wilde Av, Drexel Hill, PA 19026",,No,,,,,,,12/7/22 13:48,Alexandria_FSS,12/7/22 13:48,Alexandria_FSS,-77.13336699,38.80751908,0.6773189824765207,-1.346231217124608,25
1751,259eb1aa-0084-4d05-9291-df9cc822e290,Near_Miss,10/5/20 0:00,5,Driver,Person_Walking,No,No,Many hits and two deaths at this intersection; speed limit at top of hill but that does not slow drivers,City of Alexandria,,Crosswalk,,,No,,,"Failure_to_Yield,Speeding",,,No,,,,,,No,,,,,,,12/7/22 13:48,Alexandria_FSS,12/7/22 13:48,Alexandria_FSS,-77.13917634,38.80980618,0.6773588999018432,-1.346332609409509,25
1868,4e99cd49-6490-4112-886a-26afd8e8a19d,Near_Miss,12/15/22 17:00,7,Pedestrian,Person_Driving,No,Yes,"Pedestrian crossing from median across turn lanes and main lanes. Light for cars was green so speeds were up, it was dark, and cars had to break suddenly to avoid pedestrian.  There is a high number of pedestrians in the area (Edsall intersection,  both north and south of light) crossing not at crosswalks. ",City of Alexandria,,,Mid_Block,"Left_Turn_Lane,Through_Lane",No,,"Against_Ped_Signal,Mid_Block",,,,No,,,,,,,,,,,Outreach Event,Old town farmers market ,12/19/22 12:36,,12/19/22 12:36,,-77.13345018,38.80656953,0.6773024097026084,-1.3462326690640127,25
